{
 "week_of": "2026-09-15",
 "editor_note": "ASTRO 2026 opens in Boston a week from Saturday, so expect the next digest to be meeting-heavy. Ten top picks this week, GU-heavy: a reconstructed-IPD meta-analysis argues against routine whole-pelvic RT in high-risk prostate cancer, URONCOR 06-24 gives early safety data for moderately hypofractionated salvage RT, and GETUG-AFU 18 backs dose escalation with long-term ADT. Elsewhere, a randomised trial says open masks with surface guidance are as accurate as closed masks, ctHPV DNA surveillance earns a 98% negative predictive value, and a small randomised trial compresses cervical HDR brachytherapy into one week. The new breast section starts next week once the breast PubMed query and the five breast journal feeds have run; this sample was collected before they were added.",
 "picks": [
  {
   "id": "pmid:42727425",
   "top": true,
   "section": "gu",
   "score": 92,
   "headline": "Whole-pelvic RT does not improve survival over prostate-only RT in high-risk disease (5-trial IPD meta-analysis)",
   "summary": "Five phase 3 trials (5,172 men) of elective whole-pelvic versus prostate-only RT were pooled with reconstructed individual-patient data. Overall survival was not improved (HR 1.07, 95% CI 0.94–1.21; reconstructed-IPD HR 0.98), and the apparent gains in biochemical/progression-free (HR 0.84) and metastasis-free survival (HR 0.92) disappeared once the single PSMA-staged, single-centre POP-RT trial was excluded (0.90 and 1.00). WPRT modestly increased late grade ≥2 GU and GI toxicity without a severe-event excess; certainty was moderate for OS and very low for the progression endpoints.",
   "why_it_matters": "Routine elective nodal RT remains unproven; the plausible beneficiaries are the very-high-nodal-risk, PSMA-staged patients POP-RT enrolled, and that subgroup needs prospective confirmation.",
   "tags": [
    "meta-analysis",
    "IPD",
    "prostate",
    "target volumes"
   ]
  },
  {
   "id": "pmid:42731759",
   "top": true,
   "section": "hn",
   "score": 85,
   "headline": "OPEN phase 3: open face masks with surface guidance match closed-mask setup accuracy and patients prefer them",
   "summary": "230 patients receiving radical head-and-neck RT were randomised 1:1:1 to a standard closed 5-point mask without SGRT, an SGRT-supported open 3-point mask, or an open 5-point mask. Daily CBCT showed no difference in vertical, lateral or rotational setup error; the only significant difference was larger longitudinal shifts in the closed-mask arm (P < 0.001). Tolerability, overall experience and distress scores were significantly better with both open masks (p < 0.01).",
   "why_it_matters": "This is randomised support for switching to open-mask, SGRT-monitored immobilisation as a patient-centred standard without giving up accuracy.",
   "tags": [
    "phase 3",
    "SGRT",
    "immobilisation",
    "patient experience"
   ]
  },
  {
   "id": "pmid:42734213",
   "top": true,
   "section": "systemic",
   "score": 84,
   "headline": "NEJM: B7-H3 ADC tambotatug pelitecan beats topotecan in relapsed SCLC — OS 13.3 vs 9.4 months, HR 0.46",
   "summary": "TAISHAN-302 randomised 451 patients with small-cell lung cancer progressing after first-line platinum to tambotatug pelitecan or topotecan. At the prespecified interim analysis, median OS was 13.3 vs 9.4 months (stratified HR for death 0.46, 95% CI 0.35–0.62), PFS 7.4 vs 2.8 months (HR 0.29) and confirmed response 59.1% vs 9.7%, with fewer grade ≥3 adverse events (55.4% vs 77.9%). Open-label, interim, industry-funded (MediLink).",
   "why_it_matters": "Second-line SCLC has had no real standard beyond topotecan for decades; expect this to change systemic sequencing and the population you see for thoracic and palliative RT.",
   "tags": [
    "phase 3",
    "practice-changing",
    "SCLC",
    "ADC"
   ]
  },
  {
   "id": "pmid:42722207",
   "top": true,
   "section": "radonc",
   "score": 82,
   "headline": "PARTY: first prospective trial of online-adaptive proton SBRT — adaptation needed in 84% of fractions, 100% feasible",
   "summary": "Ten patients with abdominal, pelvic or thoracic oligometastases received 30–50 CGE in 5 fractions with an in-room CT-on-rails online adaptive proton workflow. All 50 fractions were delivered adaptively (median door-to-door 88 minutes); 42 (84%) required adaptation, roughly half for OAR constraint violations and the rest for coverage, and adapted plans improved coverage and OAR dose even after accounting for intrafraction motion. One grade 3 toxicity of unclear attribution; 3- and 6-month local control 90% and 73% with 7.8 months' follow-up.",
   "why_it_matters": "Daily anatomy, not range uncertainty alone, is what has kept proton SBRT niche; this shows online adaptation is workable end to end.",
   "tags": [
    "phase 1",
    "adaptive RT",
    "protons",
    "SBRT"
   ]
  },
  {
   "id": "pmid:42715636",
   "top": true,
   "section": "hn",
   "score": 82,
   "headline": "ctHPV DNA reappearance flags recurrence after RT for HPV+ oropharynx cancer with 98% negative predictive value",
   "summary": "Serial quantitative-PCR ctHPV DNA surveillance in 232 baseline-positive patients (2,928 assessments) treated 2012–2024 at one institution. Among 220 complete responders, ctHPV DNA reappearance had 90.3% sensitivity, 97.9% specificity, 87.5% PPV and 98.4% NPV for confirmed recurrence, and preceded clinical recurrence in 58.1% of cases. Positivity one month after treatment was strongly associated with worse OS (HR 19.1) and DFS (HR 15.4), whereas the immediate post-treatment result carried little prognostic value. Single-institution, retrospective analysis of prospectively collected tests.",
   "why_it_matters": "A negative surveillance test identifies patients at very low short-term risk, which is the argument for leaner imaging follow-up; the one-month time point is the one to watch.",
   "tags": [
    "biomarker",
    "surveillance",
    "HPV",
    "oropharynx"
   ]
  },
  {
   "id": "url:2c20abb2815241b7",
   "top": true,
   "section": "gu",
   "score": 78,
   "headline": "ASCO Post: GETUG-AFU 18 supports dose-escalated RT with long-term ADT in high-risk prostate cancer",
   "summary": "News coverage of the GETUG-AFU 18 trial, which compared dose-escalated radiotherapy with conventional dosing in high-risk localised prostate cancer treated with long-term androgen deprivation. The feed item carries only the headline, so the effect sizes are in the linked article rather than here.",
   "why_it_matters": "If the full report holds up, it strengthens the case for dose escalation when long-course ADT is already planned.",
   "tags": [
    "phase 3",
    "dose escalation",
    "ADT",
    "news"
   ]
  },
  {
   "id": "pmid:42720936",
   "top": true,
   "section": "gyn",
   "score": 78,
   "headline": "KEYNOTE-826 at 5 years: pembrolizumab plus chemotherapy keeps its survival edge in recurrent/metastatic cervical cancer",
   "summary": "Exploratory 5-year follow-up (median 59.1 months) of the 617-patient phase 3 trial in previously untreated persistent, recurrent or metastatic cervical cancer. Overall survival benefit persisted in the PD-L1 CPS ≥1 population (median 28.6 vs 16.5 months; HR 0.62, 95% CI 0.50–0.76) and the intention-to-treat population (26.4 vs 16.8 months; HR 0.64), with progression-free survival HRs of 0.58 and 0.61 and no new safety signals.",
   "why_it_matters": "The durable tail matters when counselling patients who relapse after definitive chemoradiation.",
   "tags": [
    "phase 3",
    "long-term follow-up",
    "cervix",
    "immunotherapy"
   ]
  },
  {
   "id": "pmid:42741462",
   "top": true,
   "section": "gu",
   "score": 76,
   "headline": "URONCOR 06-24 interim: moderately hypofractionated salvage RT after prostatectomy has early toxicity similar to conventional",
   "summary": "Prespecified interim analysis of the first 250 patients in this multicentre phase 3 trial; 175 received moderate hypofractionation (mostly 62.5 Gy/25) and 75 conventional fractionation (66–70 Gy/33–35). At 12.7 months, grade ≥2 GU events were 21.7% vs 17.3% (p = 0.43) and grade ≥2 GI 10.8% vs 4.0% (p = 0.079), with no clinically meaningful PRO differences; pelvic nodal RT was more common in the hypofractionated group (39.4% vs 13.3%) and was the factor linked to GI toxicity. Fractionation was not the randomised variable, so selection bias is possible.",
   "why_it_matters": "Reassuring early safety for 25-fraction salvage RT, but wait for the randomised comparison and late toxicity before calling it equivalent.",
   "tags": [
    "phase 3",
    "hypofractionation",
    "salvage RT",
    "toxicity"
   ]
  },
  {
   "id": "pmid:42717678",
   "top": true,
   "section": "hn",
   "score": 75,
   "headline": "REMATCH: response-adapted, reduced-volume surgery after neoadjuvant immunochemotherapy in HPV-negative HNSCC",
   "summary": "Single-arm phase 2 in 50 patients with resectable HPV-negative stage III–IVA HNSCC given three cycles of penpulimab, nab-paclitaxel and cisplatin; ≥50% primary regression triggered reduced-volume surgery, all followed by risk-adapted adjuvant RT. Objective response was 94%, 2-year DFS 83% overall and 90% in the 42 reduced-volume patients (100% laryngeal preservation), versus 20% in the five standard-volume patients; grade 3 events 16% (systemic) and 15% (surgical), none grade 4–5.",
   "why_it_matters": "De-escalating surgery rather than radiation is a new angle on larynx preservation, and the adjuvant RT component stayed in for everyone.",
   "tags": [
    "phase 2",
    "de-escalation",
    "neoadjuvant IO",
    "larynx preservation"
   ]
  },
  {
   "id": "pmid:42732820",
   "top": false,
   "section": "gu",
   "score": 72,
   "headline": "HYPO-RT-PC sub-study: clinicians consistently under-rate urinary and bowel symptoms after prostate RT",